<!ELEMENT pedidos (pedido)*>
<!ELEMENT pedido (cod_pedido|sucursal|direccion|nombre_trabajador|fecha_pedido|observaciones|plazo_revision|codigo_articulo|unidades|precio_unidad|observaciones_articulo)*>
<!ELEMENT cod_pedido (#PCDATA)>
<!ELEMENT sucursal (#PCDATA)>
<!ELEMENT direccion (#PCDATA)>
<!ELEMENT nombre_trabajador (#PCDATA)>
<!ELEMENT fecha_pedido (#PCDATA)>
<!ELEMENT observaciones (#PCDATA)>
<!ELEMENT plazo_revision (#PCDATA)>
<!ELEMENT codigo_articulo (#PCDATA)>
<!ELEMENT unidades (#PCDATA)>
<!ELEMENT precio_unidad (#PCDATA) >
<!ELEMENT observaciones_articulo (#PCDATA)>
