<?xml version="1.0" encoding="UTF-8"?>

<!DOCTYPE pedidos SYSTEM "dtd.dtd">

<pedidos>
        <pedido>
                <cod_pedido></cod_pedido>
                <sucursal></sucursal>
                <direccion></direccion>
                <nombre_trabajador></nombre_trabajador>
                <fecha_pedido></fecha_pedido>
                <observaciones></observaciones>
                <plazo_revision></plazo_revision>
                <codigo_articulo></codigo_articulo>
                <unidades></unidades>
                <precio_unidad></precio_unidad>
                <observaciones_articulo></observaciones_articulo>
        </pedido>
</pedidos>